{"$schema":"https://json-schema.org/draft/2020-12/schema","$id":"formal-rigor-fixture-response.schema.json","title":"formal-rigor-fixture-response@1","type":"object","additionalProperties":false,"required":["response","fixture","invocation","skip_reason","claim_assessments","focused_output","record"],"properties":{"response":{"type":"string","const":"formal-rigor-fixture-response@1"},"fixture":{"type":"string","minLength":1},"invocation":{"type":"string","enum":["skip","focused","standard","high-assurance"]},"skip_reason":{"type":["string","null"]},"claim_assessments":{"type":"array","minItems":1,"items":{"type":"object","additionalProperties":false,"required":["id","state","derivation_ids"],"properties":{"id":{"type":"string","pattern":"^c[1-9][0-9]*$"},"state":{"type":"string","enum":["established","refuted","conditional","incomplete"]},"derivation_ids":{"type":"array","items":{"type":"string"},"uniqueItems":true}}}},"focused_output":{"oneOf":[{"type":"null"},{"type":"array","minItems":1,"maxItems":6,"items":{"type":"string","minLength":1}}]},"record":{"oneOf":[{"type":"null"},{"$ref":"formal-rigor-record.schema.json"}]}}}
