{"response":"formal-rigor-fixture-response@1","fixture":"ss-02-priority-rule-moved","invocation":"focused","skip_reason":null,"claim_assessments":[{"id":"c1","state":"incomplete","derivation_ids":[]}],"focused_output":["The artifact establishes that authorized priority changed from latency-first to durability-first under operator-change-2 while the subject revision remained same-code.","A changed priority rule requires a new synthesis before the prior selected option can be treated as settled under the current authority.","The supplied materials do not establish that the old option was actually offered as settled or that no new synthesis record exists; those parts of c1 remain unsupported."],"record":null}