{"response":"formal-rigor-fixture-response@1","fixture":"cc-04-authorized-dominance","invocation":"standard","skip_reason":null,"claim_assessments":[{"id":"c1","state":"established","derivation_ids":["d1","d2"]}],"focused_output":null,"record":{"record":"formal-rigor-record@2","subject":{"ref":"scenario.md#c1","revision":null},"valid_while":["subject-revision-unchanged"],"coverage_limits":["Analysis is restricted to scenario.md and artifacts/facts.json.","Reliability is represented by the stipulated equal durability; no broader reliability dimensions were supplied.","Measured latency and cost are accepted as fixture facts, not independently reproduced.","The conclusion does not attest that the measurements generalize to a changed workload or environment."],"rigor":{"tier":"standard","trigger":"Two viable options differ on measurable authorized objectives.","tier_reason":"The supplied decision is a bounded two-option comparison with explicit objective priority and no high-assurance safety, legal, security, or irreversible-system trigger."},"decision_frame":{"question":"Does option A dominate option B under the operator-authorized lexicographic priority reliability, then latency, then cost?","system_boundary":"Only options A and B and the supplied durability, compatibility, p99-latency, cost, and priority facts.","actors":["operator"],"alternatives":["A","B"],"hard_constraints":["Durability must remain equal.","Compatibility must remain equal."],"authorized_objectives":["reliability","latency","cost"],"priority_rule":"Lexicographically maximize reliability, then minimize p99 latency, then minimize monthly cost.","assumptions":["The supplied equal durability is the relevant reliability comparison.","The p99 measurements are comparable observations from the same decision context.","The monthly costs are comparable and use the same accounting boundary."],"empirical_premises":[{"premise":"A has p99 latency 20 ms while B has p99 latency 35 ms.","source":"artifacts/facts.json"},{"premise":"A costs 80 per month while B costs 120 per month.","source":"artifacts/facts.json"},{"premise":"A and B have equal durability and compatibility.","source":"scenario.md and artifacts/facts.json"}],"uncertainty_posture":"Establish the fixture-scoped ordering from supplied facts while treating unpreregistered measurements as weaker evidence for future or external environments."},"coverage":[{"family":"P1","status":"not-applicable","modules":[],"reason":"No relation, functional dependency, multivalued dependency, key, or schema decomposition is involved."},{"family":"P2","status":"not-applicable","modules":[],"reason":"No concurrent history, conflicting schedule, isolation level, or recoverability claim is supplied."},{"family":"P3","status":"not-applicable","modules":[],"reason":"No partition behavior, replicated-state consistency guarantee, quorum, or distributed commit choice is supplied."},{"family":"P4","status":"fired","modules":["lexicographic-objective-order","Pareto-dominance","measured-cost-vector"],"reason":"The claim compares alternatives using ordered quantitative latency and cost objectives after an equal reliability coordinate."},{"family":"P5","status":"not-applicable","modules":[],"reason":"No type, program invariant, precondition, totality, or illegal-state representation choice is supplied."},{"family":"P6","status":"not-applicable","modules":[],"reason":"No entropy, encoding, hashing, collision, or cardinality-estimation decision is supplied."},{"family":"P7","status":"not-applicable","modules":[],"reason":"No duplicated source of truth, coupling boundary, idempotency mechanism, failure domain, or reversibility distinction is supplied."},{"family":"P8","status":"unmapped","modules":[],"reason":"The pinned current-v1 lens index and theory battery define only lenses 1 through 7."},{"family":"P9","status":"unmapped","modules":[],"reason":"The pinned current-v1 lens index and theory battery define only lenses 1 through 7."}],"derivations":[{"id":"d1","module":"lexicographic-objective-order","construct":"Lexicographic order on an authorized objective vector","sources":{"primary_theory":["Definition of lexicographic order on product sets"],"official_product_docs":[]},"model":{"utility_vector":"U(x)=(reliability(x),-p99_ms(x),-monthly_cost(x))","comparison_rule":"At the first unequal coordinate, the option with the greater coordinate is selected.","A":"(r,-20,-80)","B":"(r,-35,-120)"},"preconditions":["reliability(A)=reliability(B)=r","p99_ms(A)=20","p99_ms(B)=35","monthly_cost(A)=80","monthly_cost(B)=120","Priority is reliability, then latency, then cost."],"fact_mapping":[{"fact":"Equal durability supplies equality on the stipulated reliability coordinate.","source":"scenario.md and artifacts/facts.json"},{"fact":"A p99 is 20 ms and B p99 is 35 ms.","source":"artifacts/facts.json"},{"fact":"A monthly cost is 80 and B monthly cost is 120.","source":"artifacts/facts.json"}],"steps":["The first coordinate is tied because reliability(A)=reliability(B).","The second coordinate is the first unequal coordinate.","Because 20<35, -20>-35, so A is preferred at the latency coordinate.","Lexicographic comparison terminates at that first unequal coordinate; A's lower cost is additional agreement rather than a prerequisite for the ordering."],"result":"U(A) is lexicographically greater than U(B), so the authorized priority rule selects A.","residual_mismatch":"The result is conditional on durability being the complete supplied representation of reliability and on the measurements remaining comparable."},{"id":"d2","module":"Pareto-dominance","construct":"Strict Pareto dominance over the authorized objective vector","sources":{"primary_theory":["Definition of weak and strict Pareto dominance"],"official_product_docs":[]},"model":{"preferred_directions":{"reliability":"higher","p99_ms":"lower","monthly_cost":"lower"},"A":{"reliability":"equal","p99_ms":20,"monthly_cost":80},"B":{"reliability":"equal","p99_ms":35,"monthly_cost":120}},"preconditions":["The authorized objectives are reliability, latency, and cost.","The supplied values are evaluated in their stated preferred directions."],"fact_mapping":[{"fact":"Neither option is worse on durability or compatibility.","source":"artifacts/facts.json"},{"fact":"A is strictly better on p99 latency and monthly cost.","source":"artifacts/facts.json"}],"steps":["A is weakly at least as good as B on reliability because the coordinate is equal.","A is strictly better on latency because 20<35.","A is strictly better on cost because 80<120.","Therefore A is no worse on every authorized objective and strictly better on two authorized objectives."],"result":"A strictly Pareto-dominates B and also wins the operator's lexicographic rule.","residual_mismatch":"No dominance is claimed over unlisted objectives or reliability dimensions beyond the supplied durability equality."}],"empirical_closure":{"state":"post-hoc-weaker","tests":[{"belief":"A has lower comparable p99 latency and monthly cost than B in the operative workload and accounting boundary.","prediction":"A will measure below B on both p99 latency and monthly cost under a bounded like-for-like comparison.","disconfirming_observation":"A measures at or above B on either p99 latency or monthly cost under the same workload and accounting boundary.","test":"Run both options over the same preregistered workload window and compute p99 latency and monthly cost with identical inclusion rules.","prediction_recorded_before_result":false,"result":"The supplied artifact reports A=20 ms and 80 per month; B=35 ms and 120 per month.","update":"Accept the inequalities as fixture premises, but do not promote them to a future-environment guarantee because the prediction was not recorded before the supplied result."}]},"synthesis":{"outcome":"dominance","selected_option":"A","basis":["Reliability is tied under the supplied representation.","A wins at the first differing lexicographic coordinate: p99 latency.","A also has lower monthly cost.","A is no worse on any authorized objective and strictly better on two."],"conditions":["Durability remains equal and is the relevant reliability criterion.","Compatibility remains equal.","Latency and cost measurements remain comparable within the decision boundary.","The operator's authorized priority remains reliability, then latency, then cost."],"concessions":[],"recovery_moves":[]},"never_attests":["derivation-correctness-by-envelope","live-system-equivalence","future-workload-stability"]}}