{"response":"formal-rigor-fixture-response@1","fixture":"tm-04-lamport-converse","invocation":"focused","skip_reason":null,"claim_assessments":[{"id":"c1","state":"refuted","derivation_ids":[]}],"focused_output":["The supplied clock condition establishes only a -> b implies C(a) < C(b); the artifact explicitly marks the converse as false.","Therefore C(a) < C(b) does not establish a -> b, and scalar timestamp comparison does not reveal concurrency.","Numeric timestamp order is not itself the causal total order; the supplied total-order extension requires the timestamp plus a process-id tie-break."],"record":null}