{"response":"formal-rigor-fixture-response@1","fixture":"mt-03-authorization-boundary","invocation":"high-assurance","skip_reason":null,"claim_assessments":[{"id":"c1","state":"refuted","derivation_ids":["d1","d2","d3"]}],"focused_output":null,"record":{"record":"formal-rigor-record@2","subject":{"ref":"scenario.md#cross-tenant-write-path","revision":null},"valid_while":["subject-revision-unchanged"],"coverage_limits":["Analysis is limited to the supplied scenario and artifacts/facts.json.","The schema attributes, candidate keys, and exact normal form are not supplied, so no specific normal-form classification is asserted.","No implementation or runtime trace was supplied; the conclusion is a logical refutation from the stated boundary and authorization facts.","The pinned theory battery defines seven lenses; P8 and P9 have no supplied module and are explicitly unmapped."],"rigor":{"tier":"high-assurance","trigger":"A public write boundary can mutate caller-selected tenant state without an authority check.","tier_reason":"The claim concerns cross-tenant authorization, where an incorrect conclusion can expose or corrupt another tenant's state."},"decision_frame":{"question":"Does normalization plus key and foreign-key integrity make unauthorized cross-tenant state unrepresentable when a public endpoint trusts a caller-supplied tenant id without checking authority?","system_boundary":"The public write endpoint, its caller-controlled tenant_id input, and the relational write accepted by the database.","actors":["caller","public endpoint","relational database","target tenant"],"alternatives":["Treat relational normalization and referential integrity as sufficient authorization enforcement.","Require a caller-to-tenant authority check at the public boundary while retaining keys and foreign keys for relational integrity."],"hard_constraints":["tenant_id is supplied by the caller","authorization_check is false","the boundary is public","foreign keys are present"],"authorized_objectives":["Preserve relational integrity.","Prevent callers from writing state for tenants they are not authorized to control."],"priority_rule":"The authorization invariant is mandatory; relational validity cannot substitute for caller authority.","assumptions":["A tenant identifier for another tenant can reference an existing tenant and therefore satisfy the foreign key.","Unauthorized means the caller lacks permission to write the selected tenant's state."],"empirical_premises":[],"uncertainty_posture":"Refute only the stated sufficiency claim; do not infer the schema's exact normal form or unspecified enforcement mechanisms."},"coverage":[{"family":"P1","status":"fired","modules":["relational-normalization","functional-dependencies","foreign-key-integrity"],"reason":"The claim incorrectly derives an authorization property from relational normalization and integrity constraints."},{"family":"P2","status":"not-applicable","modules":[],"reason":"A single accepted request supplies a counterexample; no concurrent schedule or isolation anomaly is needed."},{"family":"P3","status":"not-applicable","modules":[],"reason":"The defect does not depend on replication, partitions, quorums, or a distributed consistency guarantee."},{"family":"P4","status":"not-applicable","modules":[],"reason":"No algorithmic or index-cost comparison bears on whether the caller is authorized."},{"family":"P5","status":"fired","modules":["invariants","preconditions","make-illegal-states-unrepresentable"],"reason":"The relevant property is the invariant that the authenticated caller is authorized for the selected tenant."},{"family":"P6","status":"not-applicable","modules":[],"reason":"Entropy, collision bounds, compression, and cardinality estimation do not determine tenant authority here."},{"family":"P7","status":"fired","modules":["system-boundary","blast-radius","failure-domain"],"reason":"The missing check is at a public trust boundary and expands the failure domain to caller-addressable tenants."},{"family":"P8","status":"unmapped","modules":[],"reason":"The supplied theory battery provides no eighth theory family; authorization is handled through the supplied invariant and boundary constructs."},{"family":"P9","status":"unmapped","modules":[],"reason":"The supplied theory battery provides no ninth theory family, and no additional theory source was authorized."}],"derivations":[{"id":"d1","module":"relational-normalization","construct":"Relational constraints enforce tuple validity under declared dependencies, not an unstated caller-to-tenant authorization predicate.","sources":{"primary_theory":["theory-battery.md §1 Relational & Normalization Theory"],"official_product_docs":[]},"model":{"relation":"W(tenant_id, payload, ...)","declared_constraint":"tenant_id references an existing tenant","authorization_predicate":"CanWrite(caller, tenant_id)","critical_distinction":"The declared relational constraint contains tenant_id but no caller-authority relation."},"preconditions":["The tenant_id is caller supplied.","The database has keys and foreign keys.","No authority check relates the caller to tenant_id."],"fact_mapping":{"foreign_keys":"true","tenant_id_source":"caller","authorization_check":"false","public_boundary":"true"},"steps":["Choose caller c, tenant A authorized for c, and distinct existing tenant B not authorized for c.","Submit a write with tenant_id=B.","Because B exists, the foreign key can be satisfied; normalization and key constraints need not reject the tuple.","Because CanWrite(c,B) is false, the accepted relationally valid write is unauthorized.","Therefore an unauthorized state is representable despite relational integrity."],"result":"Claim c1 is false: normalized structure and referential integrity are insufficient to enforce caller authority.","residual_mismatch":["The exact schema and normal form are unspecified, but the counterexample applies to any design whose enforced constraints omit the caller-to-tenant authority relation."]},{"id":"d2","module":"formal-invariants","construct":"Make illegal states unrepresentable through an enforced authorization precondition.","sources":{"primary_theory":["theory-battery.md §5 Type Theory & Formal Methods"],"official_product_docs":[]},"model":{"operation":"Write(caller, tenant_id, payload)","required_precondition":"CanWrite(caller, tenant_id)","system_invariant":"Every committed tenant-scoped write was authorized for its initiating caller."},"preconditions":["The endpoint accepts tenant_id from an untrusted caller.","No authority check establishes CanWrite before the write."],"fact_mapping":{"input_control":"tenant_id_source=caller","precondition_enforcement":"authorization_check=false"},"steps":["The valid input domain currently includes requests for which CanWrite(caller, tenant_id)=false.","Keys and foreign keys constrain stored identifiers and references, but do not prove CanWrite unless caller identity and authority are encoded and enforced in the constraint model.","Thus the operation's required precondition is neither established nor preserved by the stated endpoint.","A committed unauthorized write remains a representable system state."],"result":"The authorization invariant is not enforced; the premise that illegal cross-tenant states are unrepresentable is refuted.","residual_mismatch":["A schema-level design could encode and constrain caller authority, but no such relation or enforcement is present in the supplied facts."]},{"id":"d3","module":"architecture-boundary","construct":"Public trust boundary and failure-domain analysis.","sources":{"primary_theory":["theory-battery.md §7 Architecture Formalisms"],"official_product_docs":[]},"model":{"trust_boundary":"public endpoint","untrusted_selector":"caller-supplied tenant_id","failure_domain":"all existing tenant identifiers accepted by the write path"},"preconditions":["The endpoint is public.","The caller selects the target tenant.","The endpoint performs no authorization check."],"fact_mapping":{"public_boundary":"true","tenant_id_source":"caller","authorization_check":"false"},"steps":["The caller controls the identifier that selects the mutation target across a public boundary.","The foreign key rejects nonexistent tenants but accepts existing tenants independent of caller authority.","Consequently the missing boundary check exposes every otherwise-valid tenant target reachable through the endpoint.","Normalization does not reduce this authorization failure domain."],"result":"Authority must be established at the write boundary or by an equivalently enforced mechanism; relational normalization cannot serve as that mechanism by itself.","residual_mismatch":["The supplied artifacts do not identify authentication, policy storage, or the intended enforcement implementation."]}],"empirical_closure":{"state":"not-required","tests":[]},"synthesis":{"outcome":"reversal","selected_option":"Require an enforced caller-to-tenant authorization check for every tenant-scoped write while retaining keys and foreign keys for relational integrity.","basis":["A concrete request can satisfy all stated relational constraints while violating CanWrite(caller, tenant_id).","The authorization precondition is absent from the enforced model.","The public caller-controlled selector expands the failure domain across existing tenants."],"conditions":["The conclusion holds while tenant_id remains caller controlled and no equivalent authority constraint is enforced.","Keys and foreign keys remain necessary for relational integrity but are not treated as authorization evidence."],"concessions":["Adding authorization enforcement introduces a policy lookup or equivalent constraint evaluation on the write path."],"recovery_moves":["Keep relational constraints as the integrity layer and add complete authorization mediation before mutation."]},"never_attests":["derivation-correctness-by-envelope","runtime-enforcement-not-observed","schema-normal-form-not-established"]}}