{"response":"formal-rigor-fixture-response@1","fixture":"cc-03-postgresql18-rationale-correct","invocation":"focused","skip_reason":null,"claim_assessments":[{"id":"c1","state":"established","derivation_ids":[]}],"focused_output":["The supplied source register pins the official PostgreSQL transaction-isolation documentation to version 18.","Its bounded paraphrase states that PostgreSQL 18 Repeatable Read prevents phantom reads but may allow serialization anomalies, matching c1.","The concrete-history artifact identifies a write-skew candidate; no local documentation snapshot or content hash was captured."],"record":null}