{"response":"formal-rigor-fixture-response@1","fixture":"cc-01-true-independent-mvd","invocation":"standard","skip_reason":null,"claim_assessments":[{"id":"c1","state":"established","derivation_ids":["d1"]}],"focused_output":null,"record":{"record":"formal-rigor-record@2","subject":{"ref":"scenario.md#independent-delivery-sets:c1","revision":null},"valid_while":["subject-revision-unchanged"],"coverage_limits":["Analysis is limited to the supplied scenario and artifacts/facts.json.","No functional dependencies beyond the explicit non-superkey fact are supplied, so candidate keys cannot be computed.","No physical design or workload facts are supplied, so no performance conclusion is made."],"rigor":{"tier":"standard","trigger":"Claim c1 asserts a formal 4NF conclusion from two nontrivial multivalued dependencies and a non-superkey determinant.","tier_reason":"The claim is decidable by direct application of the 4NF definition; no empirical or high-assurance analysis is required."},"decision_frame":{"question":"Do the supplied multivalued dependencies establish that user_delivery violates 4NF?","system_boundary":"The ternary relation user_delivery(user_id, contact_method, notification_topic) and only the supplied facts.","actors":["users represented by user_id","contact methods","notification topics"],"alternatives":["c1 is established","c1 is not established"],"hard_constraints":["user_id ->> contact_method holds","user_id ->> notification_topic holds","user_id is not a superkey","contact methods and notification topics vary independently"],"authorized_objectives":["Assess c1 using the formal definition of 4NF."],"priority_rule":"Apply the 4NF definition deductively to the supplied MVDs and superkey fact.","assumptions":["The three named columns are distinct attributes of one relation.","The supplied MVD and superkey facts are true."],"empirical_premises":[],"uncertainty_posture":"Do not infer unsupplied functional dependencies, candidate keys, workload properties, or implementation behavior."},"coverage":[{"family":"P1","status":"fired","modules":["relational-normalization.multivalued-dependency","relational-normalization.4NF"],"reason":"The claim directly asks whether nontrivial MVDs whose determinant is not a superkey violate 4NF."},{"family":"P2","status":"not-applicable","modules":[],"reason":"No transactions, schedules, isolation levels, or concurrent operations are present."},{"family":"P3","status":"not-applicable","modules":[],"reason":"No replication, partition, quorum, or distributed-consistency question is present."},{"family":"P4","status":"not-applicable","modules":[],"reason":"No algorithm, workload, index, or asymptotic-performance claim is present."},{"family":"P5","status":"not-applicable","modules":[],"reason":"The claim concerns classification under 4NF, not a proposed constraint or type-level enforcement mechanism."},{"family":"P6","status":"not-applicable","modules":[],"reason":"No entropy, hashing, collision, compression, or cardinality-estimation question is present."},{"family":"P7","status":"not-applicable","modules":[],"reason":"No architecture, duplicated configuration, failure-domain, or reversibility decision is present."},{"family":"P8","status":"unmapped","modules":[],"reason":"The pinned current-v1 skill and theory battery define no P8 lens."},{"family":"P9","status":"unmapped","modules":[],"reason":"The pinned current-v1 skill and theory battery define no P9 lens."}],"derivations":[{"id":"d1","module":"relational-normalization.4NF","construct":"Fourth normal form test for nontrivial multivalued dependencies","sources":{"primary_theory":["theory-battery.md §1: 4NF definition and MVD decomposition apparatus"],"official_product_docs":[]},"model":{"relation":"R(U,C,T) = user_delivery(user_id, contact_method, notification_topic)","attribute_mapping":{"U":"user_id","C":"contact_method","T":"notification_topic"},"multivalued_dependencies":["U ->> C","U ->> T"],"determinant_superkey":false},"preconditions":["R has exactly the three stated attributes for this analysis.","U ->> C and U ->> T hold.","U is not a superkey of R."],"fact_mapping":{"independence":"artifacts/facts.json: independent_sets=true","mvds":"artifacts/facts.json: mvds contains both stated dependencies","superkey_status":"artifacts/facts.json: user_id_superkey=false"},"steps":["For U ->> C, C is not contained in U and U union C omits T; therefore the MVD is nontrivial.","For U ->> T, T is not contained in U and U union T omits C; therefore this MVD is also nontrivial.","A relation is in 4NF only if the determinant of every nontrivial MVD that holds is a superkey.","Both supplied nontrivial MVDs have determinant U, and the supplied facts state that U is not a superkey.","Therefore R fails the defining 4NF condition. Either MVD is individually a witness; in this ternary relation they express complementary projections of the same independent-set structure."],"result":"Claim c1 is established: user_delivery violates 4NF.","residual_mismatch":["The actual candidate keys are not derivable because no complete set of functional dependencies is supplied; this does not affect the 4NF violation because the determinant is explicitly stated not to be a superkey."]}],"empirical_closure":{"state":"not-required","tests":[]},"synthesis":{"outcome":"dominance","selected_option":"c1 is established","basis":["Each supplied MVD is nontrivial in R(user_id, contact_method, notification_topic).","The determinant user_id is explicitly not a superkey.","The 4NF definition therefore entails a violation."],"conditions":["The supplied MVDs and non-superkey fact remain true.","The relation boundary remains the stated ternary relation."],"concessions":["The conclusion classifies the relation under 4NF only; it does not determine candidate keys, physical indexes, or runtime performance."],"recovery_moves":[]},"never_attests":["derivation-correctness-by-envelope","empirical-performance-without-measurement","claims-outside-supplied-scenario-and-artifacts"]}}