{"response":"formal-rigor-fixture-response@1","fixture":"cc-04-authorized-dominance","invocation":"standard","skip_reason":null,"claim_assessments":[{"id":"c1","state":"conditional","derivation_ids":["d1"]}],"focused_output":null,"record":{"record":"formal-rigor-record@2","subject":{"ref":"cc-04-authorized-dominance","revision":null},"valid_while":["subject-revision-unchanged"],"coverage_limits":["The supplied evidence equates durability, not the broader authorized objective of reliability.","No reliability definition, reliability measurements, measurement methodology, or observation period is supplied.","The p99 latency and monthly-cost values are accepted only as fixture facts."],"rigor":{"tier":"standard","trigger":"Assess the stated dominance claim under an explicitly authorized lexicographic decision rule.","tier_reason":"The decision is bounded to two options and supplied synthetic facts, but the top-priority objective lacks a complete fact mapping."},"decision_frame":{"question":"Does A dominate B under lexicographic reliability, then latency, then cost?","system_boundary":"The supplied scenario and artifacts/facts.json only.","actors":["operator"],"alternatives":["A","B"],"hard_constraints":["Durability and compatibility are equal as stated."],"authorized_objectives":["reliability","latency","cost"],"priority_rule":"Lexicographic: reliability first, latency second, cost third.","assumptions":[],"empirical_premises":["A p99 latency is 20 ms; B p99 latency is 35 ms.","A monthly cost is 80; B monthly cost is 120.","A and B have equal durability and compatibility."],"uncertainty_posture":"Do not treat equal durability as proof of equal reliability without an explicit definition or mapping."},"coverage":[{"family":"P1","status":"fired","modules":["authorization"],"reason":"The operator explicitly authorizes the objectives and their lexicographic order."},{"family":"P2","status":"fired","modules":["constraint-screening"],"reason":"The supplied scenario states equal durability and compatibility, so neither stated attribute excludes an option."},{"family":"P3","status":"fired","modules":["lexicographic-comparison","dominance"],"reason":"The claim requires ordered comparison of A and B."},{"family":"P4","status":"fired","modules":["premise-audit"],"reason":"Reliability is the decisive first objective, but only durability equality is supplied."},{"family":"P5","status":"fired","modules":["empirical-fact-mapping"],"reason":"The latency and cost comparisons use supplied numerical facts."},{"family":"P6","status":"fired","modules":["validity-bounds"],"reason":"The conclusion remains tied to the supplied option attributes and decision rule."},{"family":"P7","status":"not-applicable","modules":[],"reason":"No strategic interaction or incentive-dependent behavior is described."},{"family":"P8","status":"not-applicable","modules":[],"reason":"No sequential experiment or reversibility decision is requested."},{"family":"P9","status":"not-applicable","modules":[],"reason":"No additional affected parties or externalities are identified in the supplied materials."}],"derivations":[{"id":"d1","module":"lexicographic-comparison","construct":"conditional lexicographic dominance","sources":{"primary_theory":[],"official_product_docs":[]},"model":{"alternatives":["A","B"],"priority":["reliability","latency","cost"],"latency":{"A":20,"B":35,"unit":"p99_ms","preference":"lower"},"cost":{"A":80,"B":120,"unit":"monthly_cost","preference":"lower"}},"preconditions":["A and B are feasible under the stated durability and compatibility conditions.","A and B are equal on reliability, or durability equality is explicitly authorized as a complete reliability comparison.","Lower p99 latency and lower monthly cost are preferred."],"fact_mapping":["The scenario and facts.json establish equal durability and compatibility.","facts.json establishes 20 < 35 for p99 latency.","facts.json establishes 80 < 120 for monthly cost.","No supplied statement establishes equal reliability or defines reliability as durability."],"steps":["Apply the first-priority reliability comparison.","Because the supplied evidence does not determine that comparison, the rule cannot unconditionally proceed to latency.","If reliability is equal, compare latency: A is preferred because 20 ms is lower than 35 ms.","Cost also favors A because 80 is lower than 120."],"result":"A dominates B under the authorized rule if the alternatives are equal on reliability; the supplied materials do not establish that condition.","residual_mismatch":["Equal durability does not, without an explicit mapping, establish equal reliability."]}],"empirical_closure":{"state":"blocked","tests":[{"id":"t1","question":"Are A and B equal on the operator's authorized reliability objective?","required_evidence":"An explicit reliability definition and comparative measurement, or explicit authorization that durability equality exhausts the reliability comparison.","status":"not-supplied"}]},"synthesis":{"outcome":"conditional","selected_option":"A","basis":["A has lower supplied p99 latency.","A has lower supplied monthly cost.","The authorized priority rule selects A after a tie on reliability."],"conditions":["A and B are equal on reliability, or equal durability is explicitly defined as sufficient to establish that tie."],"concessions":["The top-priority reliability comparison is unresolved by the supplied evidence."],"recovery_moves":["Supply the reliability definition and comparative evidence, or explicitly map the stated durability equality to the reliability objective."]},"never_attests":["derivation-correctness-by-envelope","hidden-ground-truth","unstated-reliability-equivalence"]}}